{
  "$schema": "http://json-schema.org/draft-04/schema",

  "type": "array",
  "items": {
    "type": "object",
    "additionalProperties": false,
    "properties": {
      "title": {
        "type": "string"
      },
      "engTitle": {
        "type": "string"
      },
      "runner": {
        "type": "string"
      },
      "commentator": {
        "type": "string"
      },
      "category": {
        "type": "string"
      },
      "hardware": {
        "type": "string"
      },
      "pk": {
        "type": "number"
      },
      "runnerPkAry": {
        "type": "array",
        "items": {
          "type": "number"
        }
      },
      "commentatorPkAry": {
        "type": "array",
        "items": {
          "type": "number"
        }
      }
    }
  }
}